{
  "schemaVersion": 1,
  "suite": "primitive",
  "registry": [
    {
      "id": "add",
      "arity": 2,
      "source": "left + right",
      "domain": "primitive"
    },
    {
      "id": "div",
      "arity": 2,
      "source": "left / right",
      "domain": "primitive"
    },
    {
      "id": "format",
      "arity": 1,
      "source": "String(value)",
      "domain": "primitive"
    },
    {
      "id": "ge",
      "arity": 2,
      "source": "left >= right",
      "domain": "primitive"
    },
    {
      "id": "gt",
      "arity": 2,
      "source": "left > right",
      "domain": "primitive"
    },
    {
      "id": "key",
      "arity": 1,
      "source": "Reflect.ownKeys({ [value]: 0 })[0]",
      "domain": "primitive"
    },
    {
      "id": "le",
      "arity": 2,
      "source": "left <= right",
      "domain": "primitive"
    },
    {
      "id": "loose",
      "arity": 2,
      "source": "left == right",
      "domain": "primitive"
    },
    {
      "id": "lt",
      "arity": 2,
      "source": "left < right",
      "domain": "primitive"
    },
    {
      "id": "math-abs",
      "arity": 1,
      "source": "Math.abs(value)",
      "domain": "primitive"
    },
    {
      "id": "math-ceil",
      "arity": 1,
      "source": "Math.ceil(value)",
      "domain": "primitive"
    },
    {
      "id": "math-floor",
      "arity": 1,
      "source": "Math.floor(value)",
      "domain": "primitive"
    },
    {
      "id": "math-max",
      "arity": 2,
      "source": "Math.max(left, right)",
      "domain": "primitive"
    },
    {
      "id": "math-min",
      "arity": 2,
      "source": "Math.min(left, right)",
      "domain": "primitive"
    },
    {
      "id": "math-round",
      "arity": 1,
      "source": "Math.round(value)",
      "domain": "primitive"
    },
    {
      "id": "math-sign",
      "arity": 1,
      "source": "Math.sign(value)",
      "domain": "primitive"
    },
    {
      "id": "math-sqrt",
      "arity": 1,
      "source": "Math.sqrt(value)",
      "domain": "primitive"
    },
    {
      "id": "math-trunc",
      "arity": 1,
      "source": "Math.trunc(value)",
      "domain": "primitive"
    },
    {
      "id": "mul",
      "arity": 2,
      "source": "left * right",
      "domain": "primitive"
    },
    {
      "id": "number",
      "arity": 1,
      "source": "+value",
      "domain": "primitive"
    },
    {
      "id": "parse",
      "arity": 1,
      "source": "Number(value)",
      "domain": "primitive"
    },
    {
      "id": "rem",
      "arity": 2,
      "source": "left % right",
      "domain": "primitive"
    },
    {
      "id": "string",
      "arity": 1,
      "source": "`${value}`",
      "domain": "primitive"
    },
    {
      "id": "sub",
      "arity": 2,
      "source": "left - right",
      "domain": "primitive"
    }
  ],
  "scenarios": [
    {
      "id": "parse",
      "operations": [
        "parse"
      ],
      "vectors": [
        {
          "id": "empty",
          "operation": "parse",
          "fixtures": [
            {
              "kind": "string",
              "value": ""
            }
          ],
          "tags": [],
          "corpusIds": []
        },
        {
          "id": "space",
          "operation": "parse",
          "fixtures": [
            {
              "kind": "string",
              "value": " "
            }
          ],
          "tags": [],
          "corpusIds": []
        },
        {
          "id": "zero",
          "operation": "parse",
          "fixtures": [
            {
              "kind": "string",
              "value": "0"
            }
          ],
          "tags": [],
          "corpusIds": []
        },
        {
          "id": "negative-zero",
          "operation": "parse",
          "fixtures": [
            {
              "kind": "string",
              "value": "-0"
            }
          ],
          "tags": [],
          "corpusIds": []
        },
        {
          "id": "positive-zero",
          "operation": "parse",
          "fixtures": [
            {
              "kind": "string",
              "value": "+0"
            }
          ],
          "tags": [],
          "corpusIds": []
        },
        {
          "id": "one",
          "operation": "parse",
          "fixtures": [
            {
              "kind": "string",
              "value": "1"
            }
          ],
          "tags": [],
          "corpusIds": []
        },
        {
          "id": "negative-one",
          "operation": "parse",
          "fixtures": [
            {
              "kind": "string",
              "value": "-1"
            }
          ],
          "tags": [],
          "corpusIds": []
        },
        {
          "id": "leading-fraction",
          "operation": "parse",
          "fixtures": [
            {
              "kind": "string",
              "value": ".5"
            }
          ],
          "tags": [],
          "corpusIds": []
        },
        {
          "id": "trailing-point",
          "operation": "parse",
          "fixtures": [
            {
              "kind": "string",
              "value": "1."
            }
          ],
          "tags": [],
          "corpusIds": []
        },
        {
          "id": "fraction",
          "operation": "parse",
          "fixtures": [
            {
              "kind": "string",
              "value": "1.25"
            }
          ],
          "tags": [],
          "corpusIds": []
        },
        {
          "id": "positive-exponent",
          "operation": "parse",
          "fixtures": [
            {
              "kind": "string",
              "value": "1e3"
            }
          ],
          "tags": [],
          "corpusIds": []
        },
        {
          "id": "negative-exponent",
          "operation": "parse",
          "fixtures": [
            {
              "kind": "string",
              "value": "1E-3"
            }
          ],
          "tags": [],
          "corpusIds": []
        },
        {
          "id": "positive-infinity",
          "operation": "parse",
          "fixtures": [
            {
              "kind": "string",
              "value": "+Infinity"
            }
          ],
          "tags": [],
          "corpusIds": []
        },
        {
          "id": "negative-infinity",
          "operation": "parse",
          "fixtures": [
            {
              "kind": "string",
              "value": "-Infinity"
            }
          ],
          "tags": [],
          "corpusIds": []
        },
        {
          "id": "hex",
          "operation": "parse",
          "fixtures": [
            {
              "kind": "string",
              "value": "0x10"
            }
          ],
          "tags": [],
          "corpusIds": []
        },
        {
          "id": "large-hex",
          "operation": "parse",
          "fixtures": [
            {
              "kind": "string",
              "value": "0Xffffffffffffffff"
            }
          ],
          "tags": [],
          "corpusIds": []
        },
        {
          "id": "octal",
          "operation": "parse",
          "fixtures": [
            {
              "kind": "string",
              "value": "0o777"
            }
          ],
          "tags": [],
          "corpusIds": []
        },
        {
          "id": "binary",
          "operation": "parse",
          "fixtures": [
            {
              "kind": "string",
              "value": "0b101010"
            }
          ],
          "tags": [],
          "corpusIds": []
        },
        {
          "id": "overflow",
          "operation": "parse",
          "fixtures": [
            {
              "kind": "string",
              "value": "1e309"
            }
          ],
          "tags": [],
          "corpusIds": []
        },
        {
          "id": "negative-overflow",
          "operation": "parse",
          "fixtures": [
            {
              "kind": "string",
              "value": "-1e309"
            }
          ],
          "tags": [],
          "corpusIds": []
        },
        {
          "id": "underflow",
          "operation": "parse",
          "fixtures": [
            {
              "kind": "string",
              "value": "1e-324"
            }
          ],
          "tags": [],
          "corpusIds": []
        },
        {
          "id": "minimum-subnormal",
          "operation": "parse",
          "fixtures": [
            {
              "kind": "string",
              "value": "5e-324"
            }
          ],
          "tags": [],
          "corpusIds": []
        },
        {
          "id": "minimum-normal",
          "operation": "parse",
          "fixtures": [
            {
              "kind": "string",
              "value": "2.2250738585072014e-308"
            }
          ],
          "tags": [],
          "corpusIds": []
        },
        {
          "id": "maximum-finite",
          "operation": "parse",
          "fixtures": [
            {
              "kind": "string",
              "value": "1.7976931348623157e308"
            }
          ],
          "tags": [],
          "corpusIds": []
        },
        {
          "id": "maximum-safe",
          "operation": "parse",
          "fixtures": [
            {
              "kind": "string",
              "value": "9007199254740991"
            }
          ],
          "tags": [],
          "corpusIds": []
        },
        {
          "id": "safe-boundary",
          "operation": "parse",
          "fixtures": [
            {
              "kind": "string",
              "value": "9007199254740992"
            }
          ],
          "tags": [],
          "corpusIds": []
        },
        {
          "id": "safe-boundary-rounded",
          "operation": "parse",
          "fixtures": [
            {
              "kind": "string",
              "value": "9007199254740993"
            }
          ],